{
  "apiVersion": "agent.delivery.loop/v0",
  "kind": "Goal",
  "metadata": {
    "id": "goal-mind-palace-health-20260629",
    "title": "Maintain Mind Palace wiki health",
    "created_at": "2026-06-29T00:00:00+08:00",
    "demand_id": "demand-mind-palace-health-20260629"
  },
  "spec": {
    "requester": {
      "kind": "human",
      "id": "requester-example"
    },
    "objective": "Maintain Mind Palace wiki health without uncontrolled live mutation.",
    "success_criteria": [
      "Weekly survey smoke succeeds",
      "Weekly lint report succeeds",
      "Index proposals are evidence-linked and reviewed before follow-up"
    ],
    "risk_boundary": {
      "docs_write": false,
      "delete_move_archive": false,
      "cron_mutation": false,
      "workflow_mutation": false,
      "profile_mutation": false,
      "external_send": true,
      "code_write": false,
      "shell_exec": false
    },
    "budget": {
      "token_limit": 120000,
      "token_used_estimate": 0,
      "max_iterations": 8,
      "max_tasks": 20,
      "stop_when_remaining_below": 15000,
      "time_limit_seconds": null,
      "escalation": "ask_requester"
    },
    "state": {
      "status": "active",
      "current_task_ids": [],
      "completed_task_ids": [],
      "blocked_reason": null
    }
  }
}
